{
  "event_number": 0,
  "world_state": {
    "location": "Baan Sawan restaurant, old quarter Bangkok, early evening monsoon season",
    "active_elements": [
      "Warm golden lighting from traditional lamps",
      "Scent of tom yum and jasmine rice mixing with rain",
      "Soft temple bells from across the street",
      "Half-empty restaurant due to weather"
    ],
    "resources": [
      "Quiet corner table by the window",
      "Grandmother's special healing tea blend",
      "Traditional Thai music playing softly"
    ]
  },
  "character_states": [
    {
      "id": "character-kamon-thanakit",
      "name": "Kamon Thanakit",
      "status": "Exhausted from another 14-hour day, shoulders heavy with unspoken burdens",
      "evolution": "Six months of routine visits, still maintaining professional distance",
      "context": "Just closed difficult merger, ghosts of past failures haunting him"
    },
    {
      "id": "character-siriporn-wongsuwan",
      "name": "Siriporn Wongsuwan",
      "status": "Contemplative mood, inspired by morning's temple meditation",
      "evolution": "Growing awareness of Kamon's visits coinciding with his hardest days",
      "context": "Recently completed secret painting about masks people wear"
    }
  ],
  "action_log": [],
  "next_event_setup": {
    "trigger": "Kamon arrives later than usual, rain-soaked and clearly distressed",
    "stakes": "First moment of genuine vulnerability might open door to connection",
    "complexity": "low"
  }
}