{
  "event_number": 1,
  "world_state": {
    "location": "NeuroCorp Research Facilities - Bangalore R&D Lab and Auckland Oceanic Platform",
    "active_elements": [
      "Neural implants confirmed to awaken dormant bio-electric human abilities rather than creating new ones",
      "Corporate security algorithms detecting anomalous research patterns - 18 hours until formal investigation",
      "Underground networks activated for data protection and resistance coordination",
      "Research subjects showing synchronized magical manifestations across global locations"
    ],
    "resources": [
      "Encrypted quantum storage drives with complete neural-magical correlation data",
      "Secure communication channels using indigenous encryption methods",
      "Traditional knowledge systems proving key to understanding phenomena",
      "Underground network contacts through Kavitha's father's legacy connections",
      "Floating city quantum networks accessible via traditional navigation protocols"
    ]
  },
  "character_states": [
    {
      "id": "character-kavitha-subramanian",
      "name": "Kavitha Subramanian",
      "status": "Underground transition - data secured, subjects protected",
      "evolution": "Activated from corporate insider to underground protector, using father's legacy network for resistance",
      "context": "Encrypted critical data, warned research subjects, preparing to go underground in 3 hours"
    },
    {
      "id": "character-tane-rahotu-williams",
      "name": "Tane Rahotu-Williams", 
      "status": "Data secured via indigenous networks, ancestral knowledge validated",
      "evolution": "Traditional wisdom integrated with cutting-edge science - indigenous methods prove superior for understanding neural-magical phenomena",
      "context": "Used MƒÅori patterns for encryption, confirmed parents' research, established secure channel with Kavitha"
    }
  ],
  "action_log": [
    {
      "event": 1,
      "summary": "Kavitha and Tane independently discovered neural implants awaken dormant human bio-electric abilities. Successfully encrypted findings using indigenous knowledge systems and established underground communication.",
      "consequences": [
        "Corporate security detection delayed 18 hours",
        "Research subjects protected",
        "Underground resistance networks activated"
      ]
    }
  ],
  "next_event_setup": {
    "trigger": "Corporate security begins formal investigation of both researchers' activities",
    "stakes": "Choice between corporate capture/silencing or successful escape to underground resistance networks",
    "complexity": "high"
  },
  "timestamp": "2025-08-02T12:00:00Z",
  "token_usage": {
    "total": 1600,
    "breakdown": {
      "setup": 300,
      "character_actions": 300,
      "mechanic_resolutions": 200,
      "state_update": 200
    }
  }
}