{
  "event_number": 0,
  "world_state": {
    "location": "Warehouse staging area 2km from border - pre-dawn darkness provides cover",
    "active_elements": [
      "3 separate tunnel entrances identified",
      "Cartel patrols on 15-minute rotation",
      "Electronic surveillance grid partially mapped",
      "Weather: dust storm approaching (visibility concern)"
    ],
    "resources": [
      "NVG equipment for all operators",
      "Breaching charges (limited supply)",
      "Suppressors and non-lethal options",
      "Medical supplies for 8 casualties",
      "Drone reconnaissance (2 units)",
      "Comms gear with encryption"
    ],
    "time_pressure": "Intel suggests hostages will be moved at sunrise (4 hours)"
  },
  "character_states": [
    {
      "id": "character-rafael-torres",
      "name": "Master Sergeant Rafael Torres",
      "status": "Peak physical condition, minor knee injury from last op",
      "evolution": "Recently promoted to team lead after Martinez's retirement",
      "context": "Reviewing tunnel maps, focused on zero casualties"
    },
    {
      "id": "character-yuki-nakamura",
      "name": "Staff Sergeant Yuki Nakamura",
      "status": "Excellent condition, heightened alertness",
      "evolution": "First hostage rescue mission, transitioning from pure tech role",
      "context": "Analyzing surveillance feeds, nervous but determined"
    },
    {
      "id": "character-dmitri-volkov",
      "name": "Sergeant First Class Dmitri Volkov",
      "status": "Strong but aging, occasional back spasms",
      "evolution": "10 years with US forces, still earning full trust",
      "context": "Preparing explosive loadout with surgical precision"
    },
    {
      "id": "character-amara-okonkwo",
      "name": "Staff Sergeant Amara Okonkwo",
      "status": "Optimal condition, recently completed trauma refresher",
      "evolution": "Returned from aid mission in Guatemala, understands cartel impact",
      "context": "Checking medical supplies, considering mass casualty scenarios"
    },
    {
      "id": "character-jackson-cooper",
      "name": "Sergeant Jackson Cooper",
      "status": "Peak conditioning, exceptional night vision",
      "evolution": "Adapting sniper skills to tunnel warfare requirements",
      "context": "Studying aerial photos, planning overwatch positions"
    },
    {
      "id": "character-kai-reeves",
      "name": "Specialist Kai Reeves",
      "status": "Excellent, completed sunrise ceremony",
      "evolution": "Recently joined Delta Force from Canadian JTF2",
      "context": "Sensing the environment, preparing spiritually for mission"
    }
  ],
  "action_log": [],
  "next_event_setup": {
    "trigger": "Final mission briefing and tunnel approach begins",
    "stakes": "Multiple hostage lives, international incident risk, 4-hour deadline",
    "complexity": "medium"
  }
}