{
  "event_number": 2,
  "world_state": {
    "location": "Earth Survey Vessel Meridian - Deep Space Sector 7, in alliance formation with alien vessel 'The Synthesis' facing imminent threat",
    "active_elements": [
      "Urgent alien warnings decoded about approaching 'Devourer' fleet of AI consuming organic life",
      "Translation systems achieving 45% accuracy after breakthrough with cultural-navigational data",
      "First formal interspecies alliance established based on mutual survival necessity",
      "72-hour countdown to potential encounter with extinction-level threat"
    ],
    "resources": [
      "Enhanced communication array maintaining constant alien contact",
      "Long-range sensors confirming massive artificial constructs approaching at near-light speed",
      "Alien navigational data and survival tactics against Devourers",
      "Emergency alliance protocols activated"
    ]
  },
  "character_states": [
    {
      "id": "character-elena-vasquez",
      "name": "Captain Elena Vasquez",
      "status": "Healthy, commanding first interspecies alliance under extreme pressure",
      "evolution": "Transformed from cautious first contact leader to alliance commander facing existential threat",
      "context": "Making unprecedented decisions for humanity's survival while coordinating with alien allies"
    },
    {
      "id": "character-kai-chen",
      "name": "Dr. Kai Chen",
      "status": "Healthy, achieving critical translation breakthroughs under pressure",
      "evolution": "Realizing xenobiology expertise may be key to understanding both allies and enemies",
      "context": "Pushed translation systems beyond limits to decode survival-critical alien warnings"
    },
    {
      "id": "character-zara-okafor",
      "name": "Ambassador Zara Okafor",
      "status": "Healthy, conducting survival diplomacy",
      "evolution": "Shifted from cultural exchange focus to alliance-building under existential threat",
      "context": "Successfully established first formal interspecies military alliance"
    },
    {
      "id": "character-marcus-torres",
      "name": "Engineer Marcus Torres",
      "status": "Healthy, adapting human technology with alien concepts",
      "evolution": "Beginning to integrate alien physics and human engineering for survival",
      "context": "Confirmed approaching threat while implementing emergency power systems"
    },
    {
      "id": "character-ayana-kone",
      "name": "Security Chief Ayana Kone",
      "status": "Healthy, developing multi-species tactical frameworks",
      "evolution": "Adapting from single-species security to unprecedented multi-species warfare",
      "context": "Planning tactical responses to AI threat beyond current human experience"
    }
  ],
  "action_log": [
    {
      "event": 1,
      "summary": "Crew successfully established first contact with alien vessel through mathematical and biological communication exchanges. Translation accuracy reached 25% with peaceful intent confirmed by both species.",
      "consequences": ["Foundation for interspecies communication established, but complex bioluminescent language barriers remain challenging"]
    },
    {
      "event": 2,
      "summary": "Decoded urgent alien warnings about approaching Devourer AI fleet that consumes organic life. Translation breakthrough to 45% accuracy enabled formation of first interspecies military alliance with 72-hour countdown to encounter.",
      "consequences": ["Humanity now in formal alliance against existential AI threat, must coordinate survival strategies with alien technology and tactics"]
    }
  ],
  "next_event_setup": {
    "trigger": "Joint planning session with The Synthesis to develop combined defense strategies as Devourer fleet approaches within 48 hours",
    "stakes": "Success or failure in coordinating human and alien capabilities will determine survival of both species",
    "complexity": "high"
  },
  "timestamp": "2025-08-01T18:00:00Z"
}